name,address,postcode,website
JG Ross Inverurie,"Highclere Business Park, Highclere Way, Inverurie",AB51 5QW,https://www.jg-ross.co.uk/coffee-shops
Mains of Drum,"East Mains of Drum, Drumoak, Banchory",AB31 5AN,https://www.mainsofdrum.co.uk/restaurant/
Andersons,"Highclere Business Park Inverurie, Aberdeenshire",AB51 5QW,https://andersonsofinverurie.co.uk/pages/coffee-shop
Kellockbank,"Culsalmond, Insch, Aberdeenshire",AB52 6SN,https://onlinestore.kellockbank.com/
Kirktown Garden Centre,"Broomhill Rd, Kirktown of Fetteresso, Stonehaven",AB39 3UP,https://kirktowngardencentre.co.uk/
The Old Pier Coffee House,The Old Pier Stonehaven,AB39 2JU,https://www.theoldpierstonehaven.com/
Thyme Out,"569 Great Western Rd, Aberdeen",AB10 6PA,https://www.facebook.com/ThymeOutCoffeeShop/
Wagamama (Aberedeen),"Union Square, Aberdeen",AB11 5RG,https://www.wagamama.com/restaurants/aberdeen/aberdeen
Forest Café,"Treehouse, Midmar Aberdeenshire",AB51 7NB,https://www.forestcafe.co.uk/
Finzean Farm Shop,"Finzean Estate Finzean, Banchory Aberdeenshire",AB31 6PA,https://www.finzean.com/farmshop
